Symbol,Name,Last Sale,Net Change,% Change,Market Cap,Country,IPO Year,Volume,Sector,Industry
IPAR,Inter Parfums Inc. Common Stock,$94.08,2.61,2.853%,2985523430.00,United States,,31054,Consumer Non-Durables,Package Goods/Cosmetics
IPAX,Inflection Point Acquisition Corp. Class A Ordinary Share,$9.63,-0.01,-0.104%,317549250.00,United States,2021,113600,,
IPAXU,Inflection Point Acquisition Corp. Units,$9.89,-0.01,-0.101%,0.00,United States,2021,200,,
IPAXW,Inflection Point Acquisition Corp. Warrants,$0.45,-0.03,-6.25%,0.00,United States,2021,103502,,
IPDN,Professional Diversity Network Inc. Common Stock,$0.9459,-0.0085,-0.891%,15198014.00,United States,2013,7951,Technology,EDP Services
IPGP,IPG Photonics Corporation Common Stock,$137.00,3.38,2.53%,7252695471.00,United States,2006,249875,Technology,Semiconductors
IPHA,Innate Pharma S.A. ADS,$3.378,0.078,2.364%,268634781.00,France,2019,2924,Health Care,Biotechnology: Pharmaceutical Preparations
IPSC,Century Therapeutics Inc. Common Stock,$13.32,0.18,1.37%,753313572.00,United States,2021,69135,Consumer Durables,Specialty Chemicals
IPVI,InterPrivate IV InfraTech Partners Inc. Class A Common Stock,$9.71,-0.03,-0.308%,348953125.00,United States,2021,1340,,
IPVIU,InterPrivate IV InfraTech Partners Inc. Units,$9.8037,-0.0763,-0.772%,0.00,United States,2021,275,,
IPVIW,InterPrivate IV InfraTech Partners Inc. Warrant,$0.50,0.00,0.00%,0.00,United States,2021,12771,,
IPW,iPower Inc. Common Stock,$1.7001,0.1101,6.925%,45033408.00,United States,2021,31141,Consumer Services,Catalog/Specialty Distribution
IPWR,Ideal Power Inc. Common Stock,$8.38,0.25,3.075%,49375345.00,United States,2013,14294,Capital Goods,Industrial Machinery/Components
IQ,iQIYI Inc. American Depositary Shares,$4.015,0.015,0.375%,3168978906.00,China,2018,5041442,Technology,Internet and Information Services
IQMD,Intelligent Medicine Acquisition Corp. Class A Common Stock,$9.91,-0.02,-0.201%,280948500.00,United States,2021,6150,,
IQMDU,Intelligent Medicine Acquisition Corp. Unit,$10.07,0.00,0.00%,285484500.00,United States,2021,2346,,
IQMDW,Intelligent Medicine Acquisition Corp. Warrant,$0.3499,-0.0001,-0.029%,0.00,United States,2021,2570,,
IRBT,iRobot Corporation Common Stock,$61.71,1.70,2.833%,1667955085.00,United States,2005,391936,,
IRCP,IRSA Propiedades Comerciales S.A. American Depositary Shares,$2.39,0.04,1.702%,323384935.00,Argentina,,48553,Consumer Services,Building operators
IRDM,Iridium Communications Inc Common Stock,$39.14,1.08,2.838%,5024536911.00,United States,,575583,Consumer Services,Telecommunications Equipment
IREN,Iris Energy Limited Ordinary Shares,$14.475,0.615,4.437%,767592850.00,Australia,2021,78157,,
IRIX,IRIDEX Corporation Common Stock,$4.48,0.04,0.901%,71078488.00,United States,1996,15457,Health Care,Biotechnology: Electromedical & Electrotherapeutic Apparatus
IRMD,iRadimed Corporation Common Stock,$47.12,-0.38,-0.80%,581543260.00,United States,2014,59357,Health Care,Medical/Dental Instruments
IROQ,IF Bancorp Inc. Common Stock,$24.10,-0.29,-1.189%,78514812.00,United States,2011,3553,Finance,Finance: Consumer Services
IRTC,iRhythm Technologies Inc. Common Stock,$130.70,4.56,3.615%,3845964738.00,United States,2016,184092,Health Care,Medical/Dental Instruments
IRWD,Ironwood Pharmaceuticals Inc. Class A Common Stock,$11.05,0.08,0.729%,1759402757.00,United States,2010,1164670,Health Care,Biotechnology: Pharmaceutical Preparations
ISAA,Iron Spark I Inc. Class A Common Stock,$9.97,0.04,0.403%,219746776.00,United States,2021,11600,,
ISBC,Investors Bancorp Inc. Common Stock,$16.91,0.89,5.556%,4193633768.00,United States,,1620292,Finance,Savings Institutions
ISEE,IVERIC bio Inc. Common Stock,$15.47,0.27,1.776%,1773500586.00,United States,2013,674942,Health Care,Biotechnology: Pharmaceutical Preparations
ISIG,Insignia Systems Inc. Common Stock,$8.99,0.14,1.582%,15895345.00,United States,1991,20733,Technology,Advertising
ISLE,Isleworth Healthcare Acquisition Corporation Common stock,$9.85,0.00,0.00%,257983813.00,United States,2021,19140,,
ISLEW,Isleworth Healthcare Acquisition Corporation Warrant,$0.1928,0.0517,36.641%,0.00,United States,2021,500,,
ISO,IsoPlexis Corporation Common Stock,$5.24,0.02,0.383%,204123922.00,United States,2021,20329,Health Care,Biotechnology: Electromedical & Electrotherapeutic Apparatus
ISPC,iSpecimen Inc. Common Stock,$3.8699,-0.2001,-4.916%,33797690.00,United States,2021,97354,Health Care,Precision Instruments
ISPO,Inspirato Incorporated Class A Common Stock,$54.56,18.07,49.52%,2560603646.00,United States,2021,3197531,Consumer Services,Hotels/Resorts
ISPOW,Inspirato Incorporated Warrant,$2.06,0.55,36.424%,0.00,United States,2021,3048150,,
ISRG,Intuitive Surgical Inc. Common Stock,$292.735,4.355,1.51%,104724198915.00,United States,2000,961657,Health Care,Medical/Dental Instruments
ISSC,Innovative Solutions and Support Inc. Common Stock,$7.66,0.16,2.133%,132301743.00,United States,2000,39155,Capital Goods,Military/Government/Technical
ISTR,Investar Holding Corporation Common Stock,$20.25,0.17,0.847%,209455754.00,United States,2014,18768,Finance,Commercial Banks
ISUN,iSun Inc. Common Stock,$5.055,0.105,2.121%,59818494.00,United States,2016,41850,Technology,Semiconductors
ITAQU,Industrial Tech Acquisitions II Inc. Unit,$9.9801,0.0001,0.001%,0.00,United States,2022,322,,
ITCI,Intra-Cellular Therapies Inc. Common Stock,$55.05,1.48,2.763%,5087480652.00,United States,,495851,Health Care,Biotechnology: Pharmaceutical Preparations
ITHX,ITHAX Acquisition Corp. Class A Ordinary Shares,$9.86,0.04,0.407%,304304250.00,United States,2021,10824,Finance,Business Services
ITHXU,ITHAX Acquisition Corp. Unit,$9.95,-0.09,-0.896%,0.00,United States,2021,1317,Finance,Business Services
ITHXW,ITHAX Acquisition Corp. Warrant,$0.30,0.015,5.263%,0.00,United States,2021,41161,Finance,Business Services
ITI,Iteris Inc. Common Stock,$3.32,0.10,3.106%,140803800.00,United States,,87954,Capital Goods,Telecommunications Equipment
ITIC,Investors Title Company Common Stock,$190.22,0.00,0.00%,360466900.00,United States,,438,Finance,Specialty Insurers
ITOS,iTeos Therapeutics Inc. Common Stock,$35.75,-0.06,-0.168%,1261041675.00,United States,2020,77016,Consumer Durables,Specialty Chemicals
ITQ,Itiquira Acquisition Corp. Class A Ordinary Shares,$9.74,0.00,0.00%,280025000.00,United States,2021,539,Finance,Business Services
ITQRU,Itiquira Acquisition Corp. Unit,$9.86,0.00,0.00%,0.00,United States,2021,76,Finance,Business Services
ITQRW,Itiquira Acquisition Corp. Warrant,$0.265,-0.055,-17.188%,0.00,United States,2021,10787,Finance,Business Services
ITRI,Itron Inc. Common Stock,$54.40,0.45,0.834%,2462810454.00,United States,1993,347863,Capital Goods,Electrical Products
ITRM,Iterum Therapeutics plc Ordinary Share,$0.368,0.031,9.199%,67261304.00,Ireland,2018,895534,Health Care,Biotechnology: Pharmaceutical Preparations
ITRN,Ituran Location and Control Ltd. Ordinary Shares,$21.25,0.41,1.967%,439607101.00,Israel,2005,20412,Technology,Electronic Components
IVA,Inventiva S.A. American Depository Shares,$12.61,0.02,0.159%,513765384.00,France,2020,11216,Consumer Services,Other Consumer Services
IVAC,Intevac Inc. Common Stock,$5.05,0.07,1.406%,125491581.00,United States,1995,66446,,
IVCB,Investcorp Europe Acquisition Corp I Class A Ordinary Shares,$9.8975,0.00,0.00%,426829688.00,Cayman Islands,2022,19,,
IVCBU,Investcorp Europe Acquisition Corp I Unit,$10.02,0.00,0.00%,0.00,Cayman Islands,2021,1,,
IVCBW,Investcorp Europe Acquisition Corp I Warrant,$0.342,-0.0049,-1.413%,0.00,Cayman Islands,2022,3201,,
IVCP,Swiftmerge Acquisition Corp. Class A Ordinary Share,$9.70,0.00,0.00%,274025000.00,Canada,2022,57,,
IVCPU,Swiftmerge Acquisition Corp. Unit,$9.95,0.00,0.00%,0.00,Canada,2021,6,,
IXAQW,IX Acquisition Corp. Warrant,$0.33,-0.0001,-0.03%,0.00,United Kingdom,2021,10010,,
IZEA,IZEA Worldwide Inc. Common Stock,$1.10,-0.05,-4.348%,68200000.00,United States,,598352,Technology,Advertising
JACK,Jack In The Box Inc. Common Stock,$86.70,1.15,1.344%,1829573572.00,United States,,262146,Consumer Services,Restaurants
JAGX,Jaguar Health Inc. Common Stock,$0.4614,-0.0066,-1.41%,23599882.00,United States,2015,1186698,Health Care,Biotechnology: Pharmaceutical Preparations
JAKK,JAKKS Pacific Inc. Common Stock,$14.96,0.11,0.741%,142172884.00,United States,1996,236657,Consumer Non-Durables,Recreational Products/Toys
JAMF,Jamf Holding Corp. Common Stock,$33.30,0.34,1.032%,3964200998.00,United States,2020,265212,Technology,Computer Software: Prepackaged Software
JAN,JanOne Inc. Common Stock (NV),$2.4981,-0.0219,-0.869%,7063153.00,United States,,11150,Public Utilities,Environmental Services
JANX,Janux Therapeutics Inc. Common Stock,$18.14,1.19,7.021%,754832791.00,United States,2021,304969,Health Care,Biotechnology: Pharmaceutical Preparations
JAQC,Jupiter Acquisition Corporation Common stock,$9.5999,-0.0001,-0.001%,194854441.00,United States,2021,32220,,
JAQCU,Jupiter Acquisition Corporation Units,$9.70,-0.04,-0.411%,0.00,United States,2021,100,,
JAQCW,Jupiter Acquisition Corporation Warrants,$0.25,0.00,0.00%,0.00,United States,2021,200,,
JAZZ,Jazz Pharmaceuticals plc Common Stock (Ireland),$138.98,4.37,3.246%,8543051262.00,Ireland,2007,344292,Health Care,Biotechnology: Pharmaceutical Preparations
JBHT,J.B. Hunt Transport Services Inc. Common Stock,$196.495,7.585,4.015%,20650445530.00,United States,,396834,Transportation,Trucking Freight/Courier Services
JBLU,JetBlue Airways Corporation Common Stock,$15.51,0.37,2.444%,4966164830.00,United States,2002,5054630,Transportation,Air Freight/Delivery Services
JBSS,John B. Sanfilippo & Son Inc. Common Stock,$80.21,1.55,1.971%,924480247.00,United States,1991,12879,Consumer Non-Durables,Specialty Foods
JCIC,Jack Creek Investment Corp. Class A Ordinary Shares,$9.75,-0.005,-0.051%,420468750.00,United States,2021,13414,Finance,Business Services
JCICU,Jack Creek Investment Corp. Units,$9.87,0.00,0.00%,0.00,United States,2021,1,Finance,Business Services
JCICW,Jack Creek Investment Corp. Warrants,$0.2576,0.0173,7.199%,0.00,United States,2021,30796,Finance,Business Services
JCS,Communications Systems Inc. Common Stock,$2.03,-0.11,-5.14%,19732873.00,United States,,27777,Public Utilities,Telecommunications Equipment
JCTCF,Jewett-Cameron Trading Company Common Shares,$7.74,0.00,0.00%,27034597.00,United States,,216,,
JD,JD.com Inc. American Depositary Shares,$72.29,1.38,1.946%,112285852155.00,China,2014,4679127,Miscellaneous,Business Services
JFIN,Jiayin Group Inc. American Depositary Shares,$2.10,-0.05,-2.326%,113452500.00,China,2019,24676,Finance,Finance: Consumer Services
JFU,9F Inc. American Depositary Shares,$1.11,0.00,0.00%,256769279.00,China,2019,13104,Finance,Finance: Consumer Services
JG,Aurora Mobile Limited American Depositary Shares,$1.155,0.065,5.963%,136781750.00,China,2018,125015,Technology,EDP Services
JGGCU,Jaguar Global Growth Corporation I Unit,$10.03,-0.05,-0.496%,0.00,United States,2022,2800,,
JJSF,J & J Snack Foods Corp. Common Stock,$163.31,5.95,3.781%,3120799718.00,United States,1986,49896,Consumer Non-Durables,Specialty Foods
JKHY,Jack Henry & Associates Inc. Common Stock,$175.24,5.17,3.04%,12761858783.00,United States,1985,375873,Technology,Retail: Computer Software & Peripheral Equipment
JMAC,Maxpro Capital Acquisition Corp. Class A Common Stock,$9.97,0.00,0.00%,136743784.00,Taiwan,2021,511,,
JMACU,Maxpro Capital Acquisition Corp. Units,$10.206,0.0024,0.024%,0.00,Taiwan,2021,1400,,
JMACW,Maxpro Capital Acquisition Corp. Warrants,$0.2799,0.0201,7.737%,0.00,Taiwan,2021,200,,
JNCE,Jounce Therapeutics Inc. Common Stock,$7.27,-0.01,-0.137%,372540892.00,United States,2017,67475,Health Care,Biotechnology: Pharmaceutical Preparations
JOAN,JOANN Inc. Common Stock,$11.20,0.51,4.771%,461226853.00,United States,2021,236771,Consumer Non-Durables,Department/Specialty Retail Stores
JOBS,51job Inc. American Depositary Shares,$51.22,-0.68,-1.31%,3454133845.00,China,2004,177723,Technology,Diversified Commercial Services
JOFF,JOFF Fintech Acquisition Corp. Class A Common Stock,$9.73,0.01,0.103%,503527500.00,United States,2021,9766,,
JOFFU,JOFF Fintech Acquisition Corp. Unit,$9.84,-0.01,-0.102%,0.00,United States,2021,16386,,
JOFFW,JOFF Fintech Acquisition Corp. Warrant,$0.3904,-0.0164,-4.031%,0.00,United States,2021,204599,,
JOUT,Johnson Outdoors Inc. Class A Common Stock,$81.92,1.91,2.387%,832065126.00,United States,,14580,Consumer Non-Durables,Recreational Products/Toys
JRSH,Jerash Holdings (US) Inc. Common Stock,$7.3088,0.0288,0.396%,90149063.00,United States,2018,25687,Basic Industries,Industrial Specialties
JRVR,James River Group Holdings Ltd. Common Shares,$26.38,0.43,1.657%,983740511.00,Bermuda,2014,103799,Finance,Property-Casualty Insurers
JSM,Navient Corporation 6% Senior Notes due December 15 2043,$23.03,0.0372,0.162%,0.00,United States,,8232,Finance,Finance: Consumer Services
JSPR,Jasper Therapeutics Inc. Common Stock,$3.69,-0.03,-0.806%,139678441.00,United States,2020,54265,Health Care,Biotechnology: Pharmaceutical Preparations
JSPRW,Japer Therapeutics Inc. Warrants,$0.35,-0.01,-2.778%,0.00,United States,2020,10006,Health Care,Biotechnology: Pharmaceutical Preparations
JUGG,Jaws Juggernaut Acquisition Corporation Class A Ordinary Share,$9.66,-0.09,-0.923%,333270000.00,United States,2021,134,,
JUGGU,Jaws Juggernaut Acquisition Corporation Unit,$9.82,-0.2005,-2.001%,0.00,United States,2021,25132,,
JUGGW,Jaws Juggernaut Acquisition Corporation Warrant,$0.65,0.00,0.00%,0.00,United States,2021,10,,
JUPW,Jupiter Wellness Inc. Common Stock,$1.2097,-0.0503,-3.992%,28695295.00,United States,2020,291916,Health Care,Biotechnology: Pharmaceutical Preparations
JUPWW,Jupiter Wellness Inc. Warrant,$0.5627,0.0177,3.248%,0.00,United States,2020,501,Health Care,Biotechnology: Pharmaceutical Preparations
JVA,Coffee Holding Co. Inc. Common Stock,$4.02,0.01,0.249%,22948568.00,United States,2005,12285,Consumer Non-Durables,Specialty Foods
JWAC,Jupiter Wellness Acquisition Corp. Class A Common Stock,$9.87,0.00,0.00%,179189850.00,United States,2022,157213,,
JWACR,Jupiter Wellness Acquisition Corp. Right,$0.211,-0.009,-4.091%,0.00,United States,2022,25200,,
JWEL,Jowell Global Ltd. Ordinary Shares,$2.93,0.03,1.034%,74629602.00,China,2021,27688,Consumer Services,Other Consumer Services
JYAC,Jiya Acquisition Corp. Class A Common Stock,$9.78,-0.01,-0.102%,131512550.00,United States,2020,282,,
JYNT,The Joint Corp. Common Stock,$41.75,-9.36,-18.313%,601756903.00,United States,2014,778866,,
JZXN,Jiuzi Holdings Inc. Ordinary Shares,$1.81,-0.02,-1.093%,38782588.00,China,2021,36548,Consumer Durables,Automotive Aftermarket
KACL,Kairous Acquisition Corp. Limited Ordinary Shares,$9.85,-0.02,-0.203%,99939509.00,Malaysia,2022,16575,,
KACLR,Kairous Acquisition Corp. Limited Rights,$0.18,0.0199,12.43%,0.00,Malaysia,2022,25900,,
KACLW,Kairous Acquisition Corp. Limited Warrants,$0.20,0.00,0.00%,0.00,Malaysia,2022,8000,,
KAII,Kismet Acquisition Two Corp. Class A Ordinary Shares,$9.73,0.01,0.103%,284602500.00,United States,2021,30282,Finance,Business Services
KAIIU,Kismet Acquisition Two Corp. Unit,$9.87,0.0499,0.508%,0.00,United States,2021,26702,Finance,Business Services
KAIIW,Kismet Acquisition Two Corp. Warrant,$0.3863,-0.0119,-2.988%,0.00,United States,2021,96123,Finance,Business Services
KAIR,Kairos Acquisition Corp. Class A Ordinary Shares,$9.75,0.00,0.00%,336375000.00,United States,2021,55,Finance,Business Services
KAIRU,Kairos Acquisition Corp. Unit,$9.90,-0.01,-0.101%,0.00,United States,2021,5540,Finance,Business Services
KAIRW,Kairos Acquisition Corp. Warrant,$0.2536,-0.0609,-19.364%,0.00,United States,2021,17700,Finance,Business Services
KALA,Kala Pharmaceuticals Inc. Common Stock,$0.6816,-0.0044,-0.641%,38210404.00,United States,2017,704451,Health Care,Biotechnology: Pharmaceutical Preparations
KALU,Kaiser Aluminum Corporation Common Stock,$97.95,2.97,3.127%,1553748722.00,United States,,91619,Basic Industries,Aluminum
KALV,KalVista Pharmaceuticals Inc. Common Stock,$16.03,0.02,0.125%,392250910.00,United Kingdom,2015,105308,Health Care,Biotechnology: Pharmaceutical Preparations
KARO,Karooooo Ltd. Ordinary Shares,$32.80,1.00,3.145%,1015196277.00,Singapore,2021,24484,Technology,Computer Software: Prepackaged Software
KAVL,Kaival Brands Innovations Group Inc. Common Stock,$2.29,-0.11,-4.583%,69234301.00,United States,,2187732,Consumer Non-Durables,Farming/Seeds/Milling
KBAL,Kimball International Inc. Class B Common Stock,$9.42,0.22,2.391%,344874386.00,United States,,137557,Consumer Durables,Industrial Specialties
KBNT,Kubient Inc. Common Stock,$1.99,0.10,5.291%,28363243.00,United States,2020,63092,Technology,EDP Services
KBNTW,Kubient Inc. Warrant,$0.4498,-0.0512,-10.22%,0.00,United States,2020,19777,Technology,EDP Services
KC,Kingsoft Cloud Holdings Limited American Depositary Shares,$6.995,-0.055,-0.78%,1690475585.00,China,2020,1352054,Technology,Computer Software: Prepackaged Software
KDNY,Chinook Therapeutics Inc. Common Stock,$12.985,-0.305,-2.295%,709127302.00,United States,2015,105164,Health Care,Biotechnology: Pharmaceutical Preparations
KDP,Keurig Dr Pepper Inc. Common Stock,$38.13,1.48,4.038%,54066875579.00,United States,,5673213,Consumer Non-Durables,Beverages (Production/Distribution)
KE,Kimball Electronics Inc. Common Stock,$17.41,-0.01,-0.057%,437142310.00,United States,,44525,Capital Goods,Industrial Machinery/Components
KELYA,Kelly Services Inc. Class A Common Stock,$21.735,0.255,1.187%,856355761.00,United States,,82709,Technology,Diversified Commercial Services
KELYB,Kelly Services Inc. Class B Common Stock,$21.62,0.15,0.699%,851824779.00,United States,,222,Technology,Diversified Commercial Services
KEQU,Kewaunee Scientific Corporation Common Stock,$14.2577,-0.4322,-2.942%,39777172.00,United States,,1486,Capital Goods,Medical Specialities
KERN,Akerna Corp. Common Stock,$1.09,-0.02,-1.802%,15323991.00,United States,2018,262089,Health Care,Managed Health Care
KERNW,Akerna Corp Warrant,$0.15,-0.0197,-11.609%,0.00,United States,2018,7358,Health Care,Managed Health Care
KFFB,Kentucky First Federal Bancorp Common Stock,$7.7501,0.00,0.00%,63691988.00,United States,,43,Finance,Savings Institutions
KFRC,Kforce Inc. Common Stock,$75.425,3.015,4.164%,1615915684.00,United States,1995,52482,Technology,Diversified Commercial Services
KHC,The Kraft Heinz Company Common Stock,$39.695,0.715,1.834%,48576367358.00,United States,,5252232,Consumer Non-Durables,Farming/Seeds/Milling
KIDS,OrthoPediatrics Corp. Common Stock,$53.68,3.71,7.424%,1056335438.00,United States,2017,55286,Health Care,Medical/Dental Instruments
KIII,Kismet Acquisition Three Corp. Class A Ordinary Shares,$9.73,-0.005,-0.051%,354536875.00,United States,2021,13171,Finance,Business Services
KIIIU,Kismet Acquisition Three Corp. Unit,$9.78,-0.02,-0.204%,0.00,United States,2021,1100,Finance,Business Services
KIIIW,Kismet Acquisition Three Corp. Warrant,$0.17,-0.01,-5.556%,0.00,United States,2021,138946,Finance,Business Services
KINS,Kingstone Companies Inc. Common Stock,$5.35,0.16,3.083%,56084756.00,United States,,3784,Finance,Specialty Insurers
KINZ,KINS Technology Group Inc. Class A Common Stock,$10.02,0.00,0.00%,345690000.00,United States,2021,40,,
KINZU,KINS Technology Group Inc. Unit,$10.09,-0.02,-0.198%,0.00,United States,2020,200,,
KINZW,KINS Technology Group Inc. Warrant,$0.2319,-0.0077,-3.214%,0.00,United States,2021,3910,,
KIRK,Kirkland's Inc. COMMONSTOCK,$14.155,0.205,1.47%,182533708.00,United States,2002,142802,Miscellaneous,Diversified Commercial Services
KLAC,KLA Corporation Common Stock,$355.99,-1.90,-0.531%,53653154955.00,United States,1980,946155,Capital Goods,Electronic Components
KLAQ,KL Acquisition Corp Class A Common Stock,$9.77,0.01,0.102%,351109375.00,United States,2021,201554,,
KLAQW,KL Acquisition Corp Warrant,$0.2765,-0.0246,-8.17%,0.00,United States,2021,27224,,
KLDO,Kaleido Biosciences Inc. Common Stock,$1.495,-0.015,-0.993%,63678553.00,United States,2019,45762,Health Care,Biotechnology: Biological Products (No Diagnostic Substances)
KLIC,Kulicke and Soffa Industries Inc. Common Stock,$53.34,0.73,1.388%,3323104830.00,Singapore,,370057,Technology,Semiconductors
KLTR,Kaltura Inc. Common Stock,$2.20,0.30,15.789%,279123775.00,United States,2021,2572755,Technology,EDP Services
KLXE,KLX Energy Services Holdings Inc. Common Stock,$6.16,0.29,4.94%,63736534.00,United States,,152900,Energy,Oilfield Services/Equipment
KMDA,Kamada Ltd. Ordinary Shares,$5.835,0.155,2.729%,261328125.00,Israel,2013,11075,Health Care,Biotechnology: Pharmaceutical Preparations
KMPH,KemPharm Inc. Common Stock,$5.85,-0.03,-0.51%,204782994.00,United States,,184467,Health Care,Biotechnology: Pharmaceutical Preparations
KNBE,KnowBe4 Inc. Class A Common Stock,$19.46,0.54,2.854%,3335711127.00,United States,2021,343172,Technology,Computer Software: Prepackaged Software
KNDI,Kandi Technologies Group Inc Common Stock,$3.2601,0.0601,1.878%,252283262.00,China,,590646,Capital Goods,Auto Parts:O.E.M.
KNSA,Kiniksa Pharmaceuticals Ltd. Class A Common Stock,$10.39,-0.07,-0.669%,715750840.00,United States,2018,144550,Health Care,Biotechnology: Pharmaceutical Preparations
KNTE,Kinnate Biopharma Inc. Common Stock,$8.235,-0.315,-3.684%,359837342.00,United States,2020,114412,Health Care,Biotechnology: Pharmaceutical Preparations
KNTK,Kinetik Holdings Inc. Class A Common Stock,$64.775,2.155,3.441%,1052364447.00,United States,2017,80991,Energy,Oil & Gas Production
KOD,Kodiak Sciences Inc Common Stock,$8.925,-0.245,-2.672%,461576778.00,United States,2018,3318350,Health Care,Biotechnology: Pharmaceutical Preparations
KOPN,Kopin Corporation Common Stock,$2.595,-0.055,-2.075%,239233585.00,United States,1992,727933,Capital Goods,Industrial Machinery/Components
KOSS,Koss Corporation Common Stock,$7.6289,0.2289,3.093%,69787613.00,United States,,28716,Consumer Non-Durables,Consumer Electronics/Appliances
KPLT,Katapult Holdings Inc. Common Stock,$2.18,0.02,0.926%,212489769.00,United States,2019,1003119,Technology,EDP Services
KPLTW,Katapult Holdings Inc. Warrant,$0.3401,0.01,3.029%,0.00,United States,2019,9400,Technology,EDP Services
KPRX,Kiora Pharmaceuticals Inc.  Common Stock,$0.5935,0.0184,3.199%,7509588.00,United States,,100117,Health Care,Biotechnology: In Vitro & In Vivo Diagnostic Substances
KPTI,Karyopharm Therapeutics Inc. Common Stock,$10.49,-0.31,-2.87%,794575540.00,United States,2013,2605219,Miscellaneous,Diversified Commercial Services
KRBP,Kiromic BioPharma Inc. Common Stock,$0.5905,-0.0131,-2.17%,9115955.00,United States,2020,60602,Consumer Durables,Specialty Chemicals
KRKR,36Kr Holdings Inc. American Depositary Shares,$0.8682,0.0493,6.02%,33473271.00,China,2019,9069,Miscellaneous,Business Services
KRMD,Repro Med Systems Inc. Common Stock,$2.95,0.00,0.00%,131639797.00,United States,,12424,Health Care,Medical/Dental Instruments
KRNL,Kernel Group Holdings Inc. Class A Ordinary Shares,$9.74,0.00,0.00%,371033125.00,United States,2021,1048,Finance,Business Services
KRNLU,Kernel Group Holdings Inc. Units,$9.86,0.00,0.00%,0.00,United States,2021,2300,Finance,Business Services
KRNLW,Kernel Group Holdings Inc. Warrants,$0.2769,0.0568,25.806%,0.00,United States,2021,15485,Finance,Business Services
KRNT,Kornit Digital Ltd. Ordinary Shares,$92.40,2.39,2.655%,4299992558.00,Israel,2015,270411,Capital Goods,Industrial Machinery/Components
KRNY,Kearny Financial Corp Common Stock,$13.27,0.43,3.349%,965432841.00,United States,,406723,Finance,Savings Institutions
KRON,Kronos Bio Inc. Common Stock,$7.33,0.31,4.416%,413025606.00,United States,2020,183739,Consumer Durables,Specialty Chemicals
KROS,Keros Therapeutics Inc. Common Stock,$52.61,1.14,2.215%,1231003345.00,United States,2020,47357,Consumer Durables,Specialty Chemicals
KRT,Karat Packaging Inc. Common Stock,$16.2601,-0.1599,-0.974%,321940614.00,United States,2021,6316,Capital Goods,Office Equipment/Supplies/Services
KRTX,Karuna Therapeutics Inc. Common Stock,$100.43,1.24,1.25%,2975093629.00,United States,2019,179971,Health Care,Biotechnology: Pharmaceutical Preparations
KRUS,Kura Sushi USA Inc. Class A Common Stock,$51.975,0.565,1.099%,504763996.00,United States,2019,49052,Consumer Services,Restaurants
KRYS,Krystal Biotech Inc. Common Stock,$61.69,0.91,1.497%,1536463540.00,United States,2017,58313,Health Care,Biotechnology: Biological Products (No Diagnostic Substances)
KSCP,Knightscope Inc. Class A Common Stock,$7.02,0.54,8.333%,99606780.00,United States,2022,1064291,Miscellaneous,Diversified Manufacture
KSI,Kadem Sustainable Impact Corporation Class A common stock,$9.705,-0.005,-0.051%,212296875.00,United States,2021,629,,
KSICW,Kadem Sustainable Impact Corporation Warrant,$0.4414,-0.0077,-1.715%,0.00,United States,2021,57187,,
KSPN,Kaspien Holdings Inc. Common Stock,$7.8345,-0.1555,-1.946%,19528024.00,United States,,1734,Consumer Services,Consumer Electronics/Video Chains
KTCC,Key Tronic Corporation Common Stock,$5.85,0.00,0.00%,62956945.00,United States,1983,10947,Technology,Computer peripheral equipment
KTOS,Kratos Defense & Security Solutions Inc. Common Stock,$18.632,0.322,1.759%,2322350984.00,United States,,1577273,Consumer Non-Durables,Ordnance And Accessories
KTRA,Kintara Therapeutics Inc. Common Stock,$0.3701,-0.0179,-4.613%,18156096.00,United States,,265929,Health Care,Biotechnology: Pharmaceutical Preparations
KTTA,Pasithea Therapeutics Corp. Common Stock,$1.015,0.045,4.639%,22216697.00,United States,2021,519949,Health Care,Biotechnology: Pharmaceutical Preparations
KTTAW,Pasithea Therapeutics Corp. Warrant,$0.18,-0.002,-1.099%,0.00,United States,2021,2017,Health Care,Biotechnology: Pharmaceutical Preparations
KURA,Kura Oncology Inc. Common Stock,$15.93,1.34,9.184%,1060233496.00,United States,,589319,Health Care,Biotechnology: Biological Products (No Diagnostic Substances)
KVHI,KVH Industries Inc. Common Stock,$8.76,0.21,2.456%,165555958.00,United States,1996,23725,Technology,Radio And Television Broadcasting And Communications Equipment
