Symbol,Name,Last Sale,Net Change,% Change,Market Cap,Country,IPO Year,Volume,Sector,Industry
PNFPP,Pinnacle Financial Partners Inc. Depositary shares of Pinnacle Financial Partners Inc. each representing a 1/40th Interest in a share of its 6.75% Fixed-Rate Non-Cumulative Perpetual Preferred Stock Series B,$26.1989,0.3989,1.546%,0.00,United States,,6751,Finance,Major Banks
PNNT,PennantPark Investment Corporation Common Stock,$7.665,0.165,2.20%,513900730.00,United States,2007,199959,Finance,Finance/Investors Services
PNRG,PrimeEnergy Resources Corporation Common Stock,$74.79,0.00,0.00%,149144498.00,United States,,73,Energy,Oil & Gas Production
PNT,POINT Biopharma Global Inc. Common Stock,$6.79,0.05,0.742%,611926981.00,United States,2020,105907,Consumer Durables,Specialty Chemicals
PNTG,The Pennant Group Inc. Common Stock ,$16.30,1.76,12.105%,464177040.00,United States,,193978,Health Care,Hospital/Nursing Management
POAI,Predictive Oncology Inc. Common Stock,$0.75,0.033,4.603%,11565755.00,United States,,177388,Health Care,Medical/Dental Instruments
PODD,Insulet Corporation Common Stock,$261.15,5.78,2.263%,18010806739.00,United States,2007,381227,Health Care,Medical/Dental Instruments
POLA,Polar Power Inc. Common Stock,$2.94,0.19,6.909%,37597317.00,United States,2016,45425,Capital Goods,Industrial Machinery/Components
PONO,Pono Capital Corp Class A Common Stock,$10.015,-0.005,-0.05%,143965625.00,United States,2021,95032,,
PONOW,Pono Capital Corp Warrant,$0.2699,0.01,3.848%,0.00,United States,2021,200,,
POOL,Pool Corporation Common Stock,$449.535,13.465,3.088%,18020946043.00,United States,1995,290498,Consumer Non-Durables,Recreational Products/Toys
POSH,Poshmark Inc. Class A Common Stock,$13.50,-0.10,-0.735%,1039540878.00,United States,2021,602917,Consumer Non-Durables,Department/Specialty Retail Stores
POW,Powered Brands Class A Ordinary Shares,$9.755,-0.005,-0.051%,336547500.00,United States,2021,1243,Finance,Business Services
POWI,Power Integrations Inc. Common Stock,$88.755,-1.295,-1.438%,5250634590.00,United States,1997,599029,Technology,Semiconductors
POWL,Powell Industries Inc. Common Stock,$21.21,-0.18,-0.842%,249511110.00,United States,,29757,Consumer Durables,Electrical Products
POWRU,Powered Brands Units,$9.85,-0.02,-0.203%,0.00,United States,2021,2163,Finance,Business Services
POWRW,Powered Brands Warrants,$0.40,0.00,0.00%,0.00,United States,2021,347,Finance,Business Services
POWW,AMMO Inc. Common Stock,$4.44,-0.01,-0.225%,512937234.00,United States,,1610129,Capital Goods,Military/Government/Technical
POWWP,AMMO Inc. 8.75% Series A Cumulative Redeemable Perpetual Preferred Stock,$27.85,0.2869,1.041%,0.00,United States,,3659,Capital Goods,Military/Government/Technical
PPBI,Pacific Premier Bancorp Inc,$38.78,1.75,4.726%,3660426478.00,United States,,122294,Finance,Major Banks
PPBT,Purple Biotech Ltd. American Depositary Shares,$2.97,0.115,4.028%,52866324.00,Israel,2015,34504,Health Care,Biotechnology: Pharmaceutical Preparations
PPC,Pilgrim's Pride Corporation Common Stock,$24.59,0.18,0.737%,5997406820.00,United States,,973165,Consumer Non-Durables,Meat/Poultry/Fish
PPGH,Poema Global Holdings Corp. Class A Ordinary Share,$9.9233,0.0133,0.134%,427942313.00,China,2021,18265,Finance,Business Services
PPGHU,Poema Global Holdings Corp. Unit,$10.49,0.14,1.353%,0.00,China,2021,12990,Finance,Business Services
PPGHW,Poema Global Holdings Corp. Warrant,$1.21,0.035,2.979%,0.00,China,2021,33582,Finance,Business Services
PPHPW,PHP Ventures Acquisition Corp. Warrants,$0.27,0.0201,8.043%,0.00,Malaysia,2021,200,,
PPIH,Perma-Pipe International Holdings Inc. Common Stock,$8.90,0.13,1.482%,71793719.00,United States,,105,,
PPSI,Pioneer Power Solutions Inc. Common Stock,$5.9699,-0.1001,-1.649%,57553090.00,United States,,79240,Consumer Durables,Electrical Products
PPTA,Perpetua Resources Corp. Common Shares,$3.595,0.225,6.677%,226274488.00,Canada,,48663,,
PPYAU,Papaya Growth Opportunity Corp. I Unit,$10.02,-0.04,-0.398%,0.00,United States,2022,10154,,
PRAA,PRA Group Inc. Common Stock,$46.01,0.76,1.68%,2006635004.00,United States,2002,121360,Technology,Advertising
PRAX,Praxis Precision Medicines Inc. Common Stock,$13.138,-0.602,-4.381%,589315198.00,United States,2020,86944,Health Care,Biotechnology: Pharmaceutical Preparations
PRCH,Porch Group Inc. Common Stock,$8.24,0.04,0.488%,807649821.00,United States,2020,830603,Technology,Computer Software: Prepackaged Software
PRCT,PROCEPT BioRobotics Corporation Common Stock,$24.555,1.335,5.749%,1068064685.00,United States,2021,162363,Health Care,Medical Specialities
PRDO,Perdoceo Education Corporation Common Stock,$10.34,0.26,2.579%,724891087.00,United States,,534000,Miscellaneous,Other Consumer Services
PRDS,Pardes Biosciences Inc. Common Stock,$7.415,0.295,4.143%,462540255.00,United States,2021,177760,Consumer Durables,Specialty Chemicals
PRFT,Perficient Inc. Common Stock,$104.49,1.51,1.466%,3441738536.00,United States,1999,210946,Technology,EDP Services
PRFX,PainReform Ltd. Ordinary Shares,$0.99,0.0431,4.552%,10377235.00,Israel,2020,10647,Health Care,Biotechnology: Pharmaceutical Preparations
PRGS,Progress Software Corporation Common Stock (DE),$44.31,0.70,1.605%,1957675087.00,United States,1991,93667,Technology,Computer Software: Prepackaged Software
PRIM,Primoris Services Corporation Common Stock,$25.72,0.41,1.62%,1384271002.00,United States,,307654,Basic Industries,Water Sewer Pipeline Comm & Power Line Construction
PRLD,Prelude Therapeutics Incorporated Common Stock,$10.38,-0.22,-2.075%,490095354.00,United States,2020,68816,Consumer Durables,Specialty Chemicals
PRLH,Pearl Holdings Acquisition Corp Class A Ordinary Shares,$9.84,0.04,0.408%,246307500.00,United States,2022,2156,,
PRLHU,Pearl Holdings Acquisition Corp Unit,$9.96,0.0099,0.099%,0.00,United States,2021,2000,,
PRLHW,Pearl Holdings Acquisition Corp Warrant,$0.30,0.00,0.00%,0.00,United States,2022,4,,
PROC,Procaps Group S.A. Ordinary Shares,$8.95,-0.04,-0.445%,1009776438.00,Luxembourg,,24145,,
PROCW,Procaps Group S.A. Warrants,$0.65,0.0545,9.152%,0.00,Luxembourg,,67849,,
PROF,Profound Medical Corp. Common Stock,$10.64,0.64,6.40%,220984831.00,Canada,,125900,,
PROG,Progenity Inc. Common Stock,$1.3029,-0.0671,-4.898%,213349297.00,United States,2020,6221954,Consumer Durables,Specialty Chemicals
PROV,Provident Financial Holdings Inc. Common Stock,$16.41,0.14,0.86%,120934594.00,United States,,10997,Finance,Savings Institutions
PRPH,ProPhase Labs Inc. Common Stock (DE),$6.60,-0.02,-0.302%,102206940.00,United States,,9536,Health Care,Biotechnology: Pharmaceutical Preparations
PRPL,Purple Innovation Inc. Common Stock,$6.10,-0.06,-0.974%,405527219.00,United States,2015,889894,Consumer Durables,Home Furnishings
PRPO,Precipio Inc.  Common Stock,$1.63,0.26,18.978%,37014597.00,United States,,379471,Capital Goods,Biotechnology: Laboratory Analytical Instruments
PRQR,ProQR Therapeutics N.V. Ordinary Shares,$1.085,0.055,5.34%,79976584.00,Netherlands,2014,850660,Health Care,Biotechnology: Pharmaceutical Preparations
PRSO,Peraso Inc. Common Stock,$2.53,0.07,2.846%,49976894.00,United States,,38277,,
PRSR,Prospector Capital Corp. Class A Ordinary Shares,$9.755,0.005,0.051%,396296875.00,United States,2021,12813,Finance,Business Services
PRSRU,Prospector Capital Corp. Unit,$9.8814,-0.0186,-0.188%,0.00,United States,2021,7592,Finance,Business Services
PRSRW,Prospector Capital Corp. Warrants,$0.4556,0.0356,8.476%,0.00,United States,2021,7953,Finance,Business Services
PRTA,Prothena Corporation plc Ordinary Shares,$35.43,0.85,2.458%,1654581000.00,United States,,287433,Health Care,Biotechnology: Pharmaceutical Preparations
PRTC,PureTech Health plc American Depositary Shares,$31.00,1.00,3.333%,892169398.00,United Kingdom,,325,Finance,Investment Managers
PRTG,Portage Biotech Inc. Common Stock,$7.545,-0.705,-8.545%,100677613.00,Canada,,32335,Health Care,Biotechnology: Biological Products (No Diagnostic Substances)
PRTH,Priority Technology Holdings Inc. Common Stock,$5.59,0.17,3.137%,428390438.00,United States,2016,11354,Technology,EDP Services
PRTK,Paratek Pharmaceuticals Inc. Common Stock,$3.56,-0.06,-1.657%,178672310.00,United States,,187324,Health Care,Biotechnology: Pharmaceutical Preparations
PRTS,CarParts.com Inc. Common Stock,$8.07,-0.04,-0.493%,402612736.00,United States,2007,305679,Consumer Services,Other Specialty Stores
PRVA,Privia Health Group Inc. Common Stock,$25.09,0.59,2.408%,2672048519.00,United States,2021,382355,Technology,Retail: Computer Software & Peripheral Equipment
PRVB,Provention Bio Inc. Common Stock,$6.46,0.11,1.732%,409400807.00,United States,2018,372923,Health Care,Biotechnology: Pharmaceutical Preparations
PSAG,Property Solutions Acquisition Corporation II Class A Common Stock,$9.705,0.005,0.052%,391732620.00,United States,2021,28220,,
PSAGU,Property Solutions Acquisition Corporation II Units,$9.77,0.02,0.205%,0.00,United States,2021,14778,,
PSAGW,Property Solutions Acquisition Corporation II Warrant,$0.33,-0.02,-5.714%,0.00,United States,2021,4062,,
PSEC,Prospect Capital Corporation Common Stock,$8.06,0.20,2.545%,3151010824.00,United States,2004,1710663,Finance,Finance/Investors Services
PSHG,Performance Shipping Inc. Common Shares,$3.15,0.15,5.00%,16010587.00,Greece,,32159,Transportation,Marine Transportation
PSMT,PriceSmart Inc. Common Stock,$72.925,0.375,0.517%,2250639864.00,United States,,51274,Consumer Services,Department/Specialty Retail Stores
PSNL,Personalis Inc. Common Stock,$10.10,0.06,0.598%,452316996.00,United States,2019,380010,Health Care,Biotechnology: In Vitro & In Vivo Diagnostic Substances
PSTI,Pluristem Therapeutics Inc. Common Stock,$1.74,0.07,4.192%,56085053.00,Israel,,56908,Health Care,Biotechnology: Biological Products (No Diagnostic Substances)
PSTV,PLUS THERAPEUTICS Inc. Common Stock ,$1.01,0.00,0.00%,21386775.00,United States,,32066,Health Care,Medical/Dental Instruments
PSTX,Poseida Therapeutics Inc. Common Stock,$3.73,0.17,4.775%,233148421.00,United States,2020,330567,Consumer Durables,Specialty Chemicals
PT,Pintec Technology Holdings Limited American Depositary Shares,$0.43,0.00,0.00%,18634433.00,China,2018,120405,Technology,Computer Software: Programming Data Processing
PTC,PTC Inc. Common Stock,$110.78,0.93,0.847%,12955963497.00,United States,,359088,Technology,Computer Software: Prepackaged Software
PTCT,PTC Therapeutics Inc. Common Stock,$35.00,-1.03,-2.859%,2497686485.00,United States,2013,278260,Health Care,Biotechnology: Pharmaceutical Preparations
PTE,PolarityTE Inc. Common Stock,$0.415,-0.0102,-2.399%,34423732.00,United States,,71217,Consumer Durables,Specialty Chemicals
PTEN,Patterson-UTI Energy Inc. Common Stock,$13.49,0.34,2.586%,2903935440.00,United States,1993,1595500,Energy,Oil & Gas Production
PTGX,Protagonist Therapeutics Inc. Common Stock,$24.34,0.09,0.371%,1161705045.00,United States,2016,298251,Health Care,Biotechnology: Pharmaceutical Preparations
PTIC,PropTech Investment Corporation II Class A Common Stock,$9.78,-0.01,-0.102%,281175000.00,United States,2021,1011,,
PTICU,PropTech Investment Corporation II Unit,$9.9157,0.0157,0.159%,0.00,United States,2020,2900,,
PTICW,PropTech Investment Corporation II Warrant,$0.39,-0.01,-2.50%,0.00,United States,2021,2200,,
PTIX,Protagenic Therapeutics Inc. Common Stock,$0.9143,-0.0076,-0.824%,15502703.00,United States,,58676,Health Care,Biotechnology: Pharmaceutical Preparations
PTIXW,Protagenic Therapeutics Inc. Warrant,$0.18,-0.0201,-10.045%,0.00,United States,,20606,Health Care,Biotechnology: Pharmaceutical Preparations
PTLO,Portillo's Inc. Class A Common Stock,$24.465,0.015,0.061%,876022439.00,United States,2021,357743,Consumer Services,Restaurants
PTMN,Portman Ridge Finance Corporation Common Stock,$24.09,0.05,0.208%,233665653.00,United States,,50684,Finance,Finance/Investors Services
PTNR,Partner Communications Company Ltd. American Depositary Shares,$7.495,0.185,2.531%,1384975425.00,Israel,,2522,Public Utilities,Telecommunications Equipment
PTOC,Pine Technology Acquisition Corp. Class A Common Stock,$9.89,0.00,0.00%,426506250.00,United States,2021,1064,,
PTOCU,Pine Technology Acquisition Corp. Unit,$9.96,0.01,0.101%,0.00,United States,2021,1600,,
PTOCW,Pine Technology Acquisition Corp. Warrant,$0.30,0.02,7.143%,0.00,United States,2021,101336,,
PTON,Peloton Interactive Inc. Class A Common Stock,$27.979,-0.321,-1.134%,9277841884.00,United States,2019,7879288,Consumer Services,Other Consumer Services
PTPI,Petros Pharmaceuticals Inc. Common Stock,$1.46,0.07,5.036%,30199696.00,United States,,277378,Health Care,Biotechnology: Pharmaceutical Preparations
PTRA,Proterra Inc. Common Stock,$8.83,0.04,0.455%,1927650625.00,United States,2020,1719446,Capital Goods,Auto Manufacturing
PTRS,Partners Bancorp Common Stock,$10.00,0.12,1.215%,179401900.00,United States,,1240,Finance,Major Banks
PTSI,P.A.M. Transportation Services Inc. Common Stock,$67.58,0.54,0.805%,755139663.00,United States,1986,27213,Transportation,Trucking Freight/Courier Services
PTVE,Pactiv Evergreen Inc. Common stock,$9.99,0.46,4.827%,1770737230.00,United States,2020,240609,Consumer Durables,Containers/Packaging
PUBM,PubMatic Inc. Class A Common Stock,$28.93,0.66,2.335%,1383620761.00,United States,2020,809427,Technology,Computer Software: Prepackaged Software
PUCK,Goal Acquisitions Corp. Common Stock,$9.73,-0.02,-0.205%,322658963.00,United States,2021,6578,,
PUCKU,Goal Acquisitions Corp. Unit,$10.07,0.02,0.199%,0.00,United States,2021,2953,,
PUCKW,Goal Acquisitions Corp. Warrant,$0.3598,-0.0061,-1.667%,0.00,United States,2021,60660,,
PULM,Pulmatrix Inc. Common Stock,$0.31,-0.0637,-17.046%,17437209.00,United States,2014,4002799,Health Care,Biotechnology: Pharmaceutical Preparations
PUYI,Puyi Inc. American Depository Shares,$7.23,0.12,1.688%,436075107.00,China,2019,110938,Finance,Investment Managers
PVBC,Provident Bancorp Inc. (MD) Common Stock,$16.59,0.64,4.013%,296208627.00,United States,2015,9937,Finance,Major Banks
PWFL,PowerFleet Inc. Common Stock,$3.655,0.025,0.689%,131408610.00,United States,,57970,Capital Goods,Telecommunications Equipment
PWOD,Penns Woods Bancorp Inc. Common Stock,$24.13,-0.09,-0.372%,170600234.00,United States,,1696,Finance,Major Banks
PWP,Perella Weinberg Partners Class A Common Stock,$10.90,0.11,1.019%,1073656333.00,United States,2020,322389,Finance,Investment Bankers/Brokers/Service
PWPPW,Perella Weinberg Partners Warrant,$2.71,0.08,3.042%,0.00,United States,2020,899,Finance,Investment Bankers/Brokers/Service
PWUPU,PowerUp Acquisition Corp. Unit,$10.00,0.00,0.00%,0.00,United States,2022,37743,,
PXLW,Pixelworks Inc.  Common Stock,$3.23,-0.01,-0.309%,171924812.00,United States,2000,318089,Technology,Semiconductors
PXS,Pyxis Tankers Inc. Common Stock,$0.5198,-0.0409,-7.294%,11206828.00,Greece,,634646,Transportation,Marine Transportation
PXSAP,Pyxis Tankers Inc. 7.75% Series A Cumulative Convertible Preferred Shares,$15.3175,0.4816,3.246%,0.00,Greece,,1741,Transportation,Marine Transportation
PYCR,Paycor HCM Inc. Common Stock,$27.405,0.875,3.298%,4793216852.00,United States,2021,242181,Technology,Computer Software: Prepackaged Software
PYPD,PolyPid Ltd. Ordinary Shares,$4.12,-0.15,-3.513%,77277068.00,Israel,2020,37593,Health Care,Medical/Dental Instruments
PYPL,PayPal Holdings Inc. Common Stock,$110.39,5.37,5.113%,128604892346.00,United States,,28751812,Miscellaneous,Business Services
PYR,PyroGenesis Canada Inc. Common Shares,$1.925,0.005,0.26%,327492155.00,Canada,,45361,,
PYXS,Pyxis Oncology Inc. Common Stock,$6.34,-0.20,-3.058%,207723044.00,United States,2021,43685,Health Care,Biotechnology: Pharmaceutical Preparations
PZZA,Papa John's International Inc. Common Stock,$107.1025,1.2825,1.212%,3894665028.00,United States,1993,484150,Consumer Services,Restaurants
QCOM,QUALCOMM Incorporated Common Stock,$170.60,2.62,1.56%,192266200000.00,United States,1991,5266924,Technology,Computer peripheral equipment
QCRH,QCR Holdings Inc. Common Stock,$56.15,1.28,2.333%,876695779.00,United States,,14671,Finance,Major Banks
QDEL,Quidel Corporation Common Stock,$107.75,3.35,3.209%,4501645551.00,United States,,611284,Health Care,Biotechnology: In Vitro & In Vivo Diagnostic Substances
QFIN,360 DigiTech Inc. American Depositary Shares,$19.76,-0.04,-0.202%,3054102241.00,China,2018,554205,Finance,Finance: Consumer Services
QH,Quhuo Limited American Depository Shares,$0.67,0.0202,3.109%,29672008.00,China,2020,12635,Miscellaneous,Business Services
QIPT,Quipt Home Medical Corp. Common Shares,$4.865,0.005,0.103%,162267210.00,United States,,30018,,
QIWI,QIWI plc American Depositary Shares,$5.63,0.47,9.109%,351485595.00,Cyprus,2013,1009730,Miscellaneous,Business Services
QK,Q&K International Group Limited American Depositary Shares,$0.3725,-0.0174,-4.463%,20550189.00,China,2019,11338,Finance,Real Estate
QLGN,Qualigen Therapeutics Inc. Common Stock,$0.6372,0.0321,5.305%,22485194.00,United States,2015,163896,Health Care,Biotechnology: Commercial Physical & Biological Resarch
QLI,Qilian International Holding Group Ltd. Ordinary Shares,$1.87,0.15,8.721%,66852500.00,China,2021,4939,Health Care,Biotechnology: Pharmaceutical Preparations
QLYS,Qualys Inc. Common Stock,$122.41,1.09,0.898%,4777590690.00,United States,2012,203062,Technology,EDP Services
QMCO,Quantum Corporation Common Stock,$2.585,0.085,3.40%,155398438.00,United States,,349499,Technology,Electronic Components
QNRX,Quoin Pharmaceuticals Ltd. American Depositary Shares,$1.07,0.01,0.943%,8973690.00,Israel,2016,143190,Health Care,Medical/Dental Instruments
QNST,QuinStreet Inc. Common Stock,$11.24,0.19,1.719%,613180609.00,United States,2010,112611,Technology,Advertising
QQQX,Nuveen NASDAQ 100 Dynamic Overwrite Fund Shares of Beneficial Interest,$25.94,0.56,2.206%,1121702045.00,United States,,138878,Finance,Finance Companies
QRHC,Quest Resource Holding Corporation Common Stock,$6.755,-0.075,-1.098%,128486490.00,United States,,37687,Capital Goods,Building Products
QRTEA,Qurate Retail Inc. Series A Common Stock ,$5.935,-0.135,-2.224%,2354670910.00,United States,,4100865,Consumer Services,Catalog/Specialty Distribution
QRTEB,Qurate Retail Inc. Series B Common Stock ,$6.095,0.045,0.744%,2418149822.00,United States,,911,Consumer Services,Catalog/Specialty Distribution
QRTEP,Qurate Retail Inc. 8.0% Fixed Rate Cumulative Redeemable Preferred Stock,$94.6178,0.4178,0.444%,0.00,United States,,63166,Consumer Services,Catalog/Specialty Distribution
QRVO,Qorvo Inc. Common Stock,$137.83,0.93,0.679%,14945131149.00,United States,,681793,Capital Goods,Industrial Machinery/Components
QSI,Quantum-Si Incorporated Class A Common Stock,$4.295,-0.165,-3.70%,590202935.00,United States,2020,775307,Health Care,Biotechnology: Pharmaceutical Preparations
QSIAW,Quantum-Si Incorporated Warrant,$0.9299,0.0799,9.40%,0.00,United States,2020,5703,Health Care,Biotechnology: Pharmaceutical Preparations
QTEK,QualTek Services Inc. Class A Common Stock,$3.42,-0.03,-0.87%,73773788.00,United States,2021,127343,Consumer Services,Telecommunications Equipment
QTEKW,QualTek Services Inc. Warrant,$0.4385,0.0083,1.929%,0.00,United States,2021,2901,Consumer Services,Telecommunications Equipment
QTNT,Quotient Limited Ordinary Shares,$1.3653,0.0553,4.221%,140078580.00,Switzerland,2014,152990,Health Care,Biotechnology: In Vitro & In Vivo Diagnostic Substances
QTRX,Quanterix Corporation Common Stock,$32.04,1.01,3.255%,1174202497.00,United States,2017,205772,Health Care,Industrial Specialties
QTT,Qutoutiao Inc. American Depositary Shares,$1.72,-0.03,-1.714%,49448581.00,China,2018,29366,Technology,Computer Software: Prepackaged Software
QUBT,Quantum Computing Inc. Common Stock,$2.67,-0.07,-2.555%,77848696.00,United States,,98824,Technology,Computer Manufacturing
QUIK,QuickLogic Corporation Common Stock,$5.15,0.11,2.183%,61142026.00,United States,1999,22754,Technology,Semiconductors
QUMU,Qumu Corporation Common Stock,$1.87,0.01,0.538%,33252424.00,United States,,12605,Technology,Retail: Computer Software & Peripheral Equipment
QURE,uniQure N.V. Ordinary Shares,$16.91,0.87,5.424%,781482866.00,Netherlands,2014,354637,Health Care,Biotechnology: Pharmaceutical Preparations
RACB,Research Alliance Corp. II Class A Common Stock,$9.71,-0.01,-0.103%,186300915.00,United States,2021,740,,
RACYU,Relativity Acquisition Corp. Unit,$10.05,0.02,0.199%,0.00,,2022,790,,
RADA,RADA Electronic Industries Ltd. Ordinary Shares,$11.66,0.41,3.644%,507035858.00,Israel,,323185,,
RADI,Radius Global Infrastructure Inc. Class A Common Stock,$12.995,0.135,1.05%,1198139000.00,United States,,455389,Consumer Services,Telecommunications Equipment
RAIL,FreightCar America Inc. Common Stock,$3.88,0.00,0.00%,61875245.00,United States,2005,67644,Capital Goods,Railroads
RAIN,Rain Therapeutics Inc. Common Stock,$6.40,0.08,1.266%,169387174.00,United States,2021,16217,Health Care,Biotechnology: Pharmaceutical Preparations
RAM,Aries I Acquisition Corporation Class A Ordinary Share,$10.0132,0.0032,0.032%,179924688.00,Cayman Islands,2021,1299,Finance,Business Services
RAMMU,Aries I Acquisition Corporation Unit,$10.18,-0.0084,-0.082%,0.00,Cayman Islands,2021,495,Finance,Business Services
RAMMW,Aries I Acquisition Corporation Warrant,$0.39,0.00,0.00%,0.00,Cayman Islands,2021,21483,Finance,Business Services
RAND,Rand Capital Corporation Common Stock,$14.80,-0.06,-0.404%,38199111.00,United States,,1194,Finance,Finance/Investors Services
RANI,Rani Therapeutics Holdings Inc. Class A Common Stock,$13.96,1.09,8.469%,275215704.00,United States,2021,51834,Consumer Durables,Specialty Chemicals
RAPT,RAPT Therapeutics Inc. Common Stock,$18.715,-0.455,-2.374%,552954475.00,United States,2019,209720,Health Care,Biotechnology: Pharmaceutical Preparations
RARE,Ultragenyx Pharmaceutical Inc. Common Stock,$67.25,-0.57,-0.84%,4666126052.00,United States,2014,196319,Health Care,Biotechnology: Pharmaceutical Preparations
RAVE,Rave Restaurant Group Inc. Common Stock,$1.04,0.0194,1.901%,18725100.00,United States,,25186,Consumer Services,Restaurants
RBB,RBB Bancorp Common Stock,$23.07,1.54,7.153%,448839400.00,United States,2017,30502,Finance,Commercial Banks
RBBN,Ribbon Communications Inc. Common Stock,$3.185,-0.005,-0.157%,473370291.00,United States,,434056,Technology,EDP Services
RBCAA,Republic Bancorp Inc. Class A Common Stock,$46.77,1.52,3.359%,934510715.00,United States,1998,8356,Finance,Major Banks
RBCN,Rubicon Technology Inc. Common Stock,$9.04,0.06,0.668%,22108956.00,United States,2007,8751,Technology,Semiconductors
RBKB,Rhinebeck Bancorp Inc. Common Stock,$10.715,0.165,1.564%,121037744.00,United States,2019,1916,Finance,Major Banks
RCAC,Revelstone Capital Acquisition Corp. Class A Common Stock,$9.84,0.01,0.102%,202950000.00,United States,2022,485,,
RCACW,Revelstone Capital Acquisition Corp. Warrant,$0.25,0.0298,13.533%,0.00,United States,2022,1826,,
RCAT,Red Cat Holdings Inc. Common Stock,$1.785,0.075,4.386%,96096509.00,United States,,103169,Technology,Retail: Computer Software & Peripheral Equipment
RCEL,Avita Medical Inc. Common Stock,$9.085,0.135,1.508%,226444697.00,United States,,44979,Health Care,Medical Specialities
RCHG,Recharge Acquisition Corp. Class A Common Stock,$9.94,0.00,0.00%,248997000.00,United States,2020,114,,
RCHGW,Recharge Acquisition Corp. Warrant,$0.25,-0.019,-7.063%,0.00,United States,2020,14048,,
RCII,Rent-A-Center Inc. Common Stock,$28.93,-0.12,-0.413%,1913437085.00,United States,1995,1495552,Technology,Diversified Commercial Services
RCKT,Rocket Pharmaceuticals Inc. Common Stock,$17.61,-0.18,-1.012%,1134834204.00,United States,2015,185189,Health Care,Biotechnology: Pharmaceutical Preparations
RCKY,Rocky Brands Inc. Common Stock,$39.585,0.705,1.813%,288978377.00,United States,1993,7227,Consumer Non-Durables,Shoe Manufacturing
RCLF,Rosecliff Acquisition Corp I Class A Common Stock,$9.84,-0.02,-0.203%,311190000.00,United States,2021,15780,,
RCLFU,Rosecliff Acquisition Corp I Unit,$9.95,0.03,0.302%,0.00,United States,2021,755,,
RCLFW,Rosecliff Acquisition Corp I Warrants,$0.28,0.0396,16.473%,0.00,United States,2021,3016,,
RCM,R1 RCM Inc. Common Stock,$27.16,0.11,0.407%,7557102694.00,United States,,998716,Consumer Services,Other Consumer Services
RCMT,RCM Technologies Inc. Common Stock,$7.235,0.385,5.62%,75851856.00,United States,,14689,Consumer Services,Military/Government/Technical
RCON,Recon Technology Ltd. Class A Ordinary Shares,$0.9097,-0.07,-7.145%,6552416.00,China,2009,886285,Energy,Oilfield Services/Equipment
RCRT,Recruiter.com Group Inc. Common Stock,$2.57,0.04,1.581%,37416424.00,United States,,21116,,
RCRTW,Recruiter.com Group Inc. Warrant,$0.7998,-0.0702,-8.069%,0.00,United States,,4600,,
RDBX,Redbox Entertainment Inc. Class A Common Stock,$1.6699,-0.0501,-2.913%,21071660.00,United States,2020,241491,,
RDBXW,Redbox Entertainment Inc. Warrant,$0.2352,-0.0048,-2.00%,0.00,United States,2020,62373,,
RDCM,Radcom Ltd. Ordinary Shares,$11.67,0.18,1.567%,162722466.00,Israel,1997,13913,Technology,Computer peripheral equipment
RDFN,Redfin Corporation Common Stock,$21.265,-1.365,-6.032%,2262524805.00,United States,2017,1998802,Finance,Real Estate
RDHL,Redhill Biopharma Ltd. American Depositary Shares,$2.1692,0.0292,1.364%,113669557.00,Israel,,129172,Health Care,Biotechnology: Pharmaceutical Preparations
RDI,Reading International Inc Class A Common Stock,$4.43,-0.01,-0.225%,96615664.00,United States,,5631,Consumer Services,Movies/Entertainment
RDIB,Reading International Inc Class B Common Stock,$20.15,0.05,0.249%,439459511.00,United States,,961,Consumer Services,Movies/Entertainment
RDNT,RadNet Inc. Common Stock,$24.45,0.54,2.258%,1373303615.00,United States,,143561,Health Care,Medical Specialities
RDUS,Radius Health Inc. Common Stock,$8.125,-0.025,-0.307%,384655456.00,United States,2014,533009,Health Care,Biotechnology: Pharmaceutical Preparations
RDVT,Red Violet Inc. Common Stock ,$27.43,-0.15,-0.544%,368067782.00,United States,,13211,Technology,Computer Software: Prepackaged Software
RDWR,Radware Ltd. Ordinary Shares,$32.92,0.60,1.856%,1514277566.00,Israel,1999,140793,Miscellaneous,Business Services
